{
  "counts": {
    "blockedRows": 0,
    "briefBlockedPaperRows": 0,
    "briefReadyPaperRows": 8,
    "forbiddenRawMarkerRows": 0,
    "notApplicableRows": 2,
    "paperReadbackRows": 8,
    "privatePathLeakRows": 0,
    "readbackReadyRows": 6,
    "rowCount": 8,
    "schemaViolationCount": 0
  },
  "generatedAt": "2026-06-08T15:48:48Z",
  "policy": {
    "dbVectorMutation": false,
    "localOnlyRawArtifactRefs": true,
    "modelCallsAllowed": false,
    "publicDefaultPromotionAllowed": false,
    "reportOnly": true,
    "vaultRead": false
  },
  "profile": "paper-understanding-readback",
  "requirements": {
    "briefProfileSlots": [
      "claim",
      "method",
      "evidence",
      "limitation",
      "purpose_relevance"
    ],
    "requiresCitationLabel": true,
    "requiresSnippetHash": true,
    "requiresSourceHash": true
  },
  "rows": [
    {
      "blockedPaperCount": 0,
      "caseId": "single_paper_attention",
      "expectedSourceIds": [
        "1706.03762"
      ],
      "paperReadbacks": [
        {
          "availableSlots": [
            "claim",
            "method",
            "evidence",
            "limitation",
            "purpose_relevance"
          ],
          "briefReady": true,
          "coreReady": true,
          "missingBriefSlots": [],
          "slots": [
            {
              "citationLabel": "S1",
              "contentHash": "sha256:2d77fa9629e22a4e1d70afe64261cafcd970972e2c4c2bd0f7d6fad20955439f",
              "excerpt": "Provided proper attribution is provided, Google hereby grants permission to reproduce the tables and figures in this paper solely for use in journalistic or scholarly works. Attention Is All You Need Ashish Vaswani∗ Google Brain avaswani@google.com Noam Shazeer∗ Google Brain noam@google.com Niki Parmar∗ Google Research nikip@google.com Jakob Uszkoreit∗ Google Research usz@google.com Llion Jones∗ Google Research llion@google.com Aidan N. Gomez∗† University of Toronto aidan@cs.toronto.edu Łukasz Kaiser∗ Google Brain lukaszkaiser@google.com Illia Polosukhin∗‡ illia.polosukhin@gmail.com Abstract The dominant sequence transduction models are based on complex recurrent or convolutional neural netw",
              "locator": "chars:25-2880",
              "slot": "claim",
              "snippetHash": "sha256:c7010b53564c8251672fa3136bc5228040ce2d3335a39bad342b77bdfa8b8153",
              "sourceId": "1706.03762",
              "sourceRef": "papers_dir/parsed/1706.03762/document.md",
              "status": "ready",
              "warnings": []
            },
            {
              "citationLabel": "S1",
              "contentHash": "sha256:2d77fa9629e22a4e1d70afe64261cafcd970972e2c4c2bd0f7d6fad20955439f",
              "excerpt": "Provided proper attribution is provided, Google hereby grants permission to reproduce the tables and figures in this paper solely for use in journalistic or scholarly works. Attention Is All You Need Ashish Vaswani∗ Google Brain avaswani@google.com Noam Shazeer∗ Google Brain noam@google.com Niki Parmar∗ Google Research nikip@google.com Jakob Uszkoreit∗ Google Research usz@google.com Llion Jones∗ Google Research llion@google.com Aidan N. Gomez∗† University of Toronto aidan@cs.toronto.edu Łukasz Kaiser∗ Google Brain lukaszkaiser@google.com Illia Polosukhin∗‡ illia.polosukhin@gmail.com Abstract The dominant sequence transduction models are based on complex recurrent or convolutional neural netw",
              "locator": "chars:25-2880",
              "slot": "method",
              "snippetHash": "sha256:c7010b53564c8251672fa3136bc5228040ce2d3335a39bad342b77bdfa8b8153",
              "sourceId": "1706.03762",
              "sourceRef": "papers_dir/parsed/1706.03762/document.md",
              "status": "ready",
              "warnings": []
            },
            {
              "citationLabel": "S1",
              "contentHash": "sha256:2d77fa9629e22a4e1d70afe64261cafcd970972e2c4c2bd0f7d6fad20955439f",
              "excerpt": "Provided proper attribution is provided, Google hereby grants permission to reproduce the tables and figures in this paper solely for use in journalistic or scholarly works. Attention Is All You Need Ashish Vaswani∗ Google Brain avaswani@google.com Noam Shazeer∗ Google Brain noam@google.com Niki Parmar∗ Google Research nikip@google.com Jakob Uszkoreit∗ Google Research usz@google.com Llion Jones∗ Google Research llion@google.com Aidan N. Gomez∗† University of Toronto aidan@cs.toronto.edu Łukasz Kaiser∗ Google Brain lukaszkaiser@google.com Illia Polosukhin∗‡ illia.polosukhin@gmail.com Abstract The dominant sequence transduction models are based on complex recurrent or convolutional neural netw",
              "locator": "chars:25-2880",
              "slot": "evidence",
              "snippetHash": "sha256:c7010b53564c8251672fa3136bc5228040ce2d3335a39bad342b77bdfa8b8153",
              "sourceId": "1706.03762",
              "sourceRef": "papers_dir/parsed/1706.03762/document.md",
              "status": "ready",
              "warnings": []
            },
            {
              "citationLabel": "S1",
              "contentHash": "sha256:2d77fa9629e22a4e1d70afe64261cafcd970972e2c4c2bd0f7d6fad20955439f",
              "excerpt": "Provided proper attribution is provided, Google hereby grants permission to reproduce the tables and figures in this paper solely for use in journalistic or scholarly works. Attention Is All You Need Ashish Vaswani∗ Google Brain avaswani@google.com Noam Shazeer∗ Google Brain noam@google.com Niki Parmar∗ Google Research nikip@google.com Jakob Uszkoreit∗ Google Research usz@google.com Llion Jones∗ Google Research llion@google.com Aidan N. Gomez∗† University of Toronto aidan@cs.toronto.edu Łukasz Kaiser∗ Google Brain lukaszkaiser@google.com Illia Polosukhin∗‡ illia.polosukhin@gmail.com Abstract The dominant sequence transduction models are based on complex recurrent or convolutional neural netw",
              "locator": "chars:25-2880",
              "slot": "limitation",
              "snippetHash": "sha256:c7010b53564c8251672fa3136bc5228040ce2d3335a39bad342b77bdfa8b8153",
              "sourceId": "1706.03762",
              "sourceRef": "papers_dir/parsed/1706.03762/document.md",
              "status": "ready",
              "warnings": []
            },
            {
              "citationLabel": "S1",
              "contentHash": "sha256:2d77fa9629e22a4e1d70afe64261cafcd970972e2c4c2bd0f7d6fad20955439f",
              "excerpt": "Provided proper attribution is provided, Google hereby grants permission to reproduce the tables and figures in this paper solely for use in journalistic or scholarly works. Attention Is All You Need Ashish Vaswani∗ Google Brain avaswani@google.com Noam Shazeer∗ Google Brain noam@google.com Niki Parmar∗ Google Research nikip@google.com Jakob Uszkoreit∗ Google Research usz@google.com Llion Jones∗ Google Research llion@google.com Aidan N. Gomez∗† University of Toronto aidan@cs.toronto.edu Łukasz Kaiser∗ Google Brain lukaszkaiser@google.com Illia Polosukhin∗‡ illia.polosukhin@gmail.com Abstract The dominant sequence transduction models are based on complex recurrent or convolutional neural netw",
              "locator": "chars:25-2880",
              "slot": "purpose_relevance",
              "snippetHash": "sha256:c7010b53564c8251672fa3136bc5228040ce2d3335a39bad342b77bdfa8b8153",
              "sourceId": "1706.03762",
              "sourceRef": "papers_dir/parsed/1706.03762/document.md",
              "status": "ready",
              "warnings": []
            }
          ],
          "sourceId": "1706.03762",
          "warnings": []
        }
      ],
      "readyPaperCount": 1,
      "runId": "single_paper_attention__A_hybrid_k5",
      "status": "ready",
      "variantId": "A_hybrid_k5",
      "warnings": []
    },
    {
      "blockedPaperCount": 0,
      "caseId": "single_paper_attention",
      "expectedSourceIds": [
        "1706.03762"
      ],
      "paperReadbacks": [
        {
          "availableSlots": [
            "claim",
            "method",
            "evidence",
            "limitation",
            "purpose_relevance"
          ],
          "briefReady": true,
          "coreReady": true,
          "missingBriefSlots": [],
          "slots": [
            {
              "citationLabel": "S1",
              "contentHash": "sha256:2d77fa9629e22a4e1d70afe64261cafcd970972e2c4c2bd0f7d6fad20955439f",
              "excerpt": "Provided proper attribution is provided, Google hereby grants permission to reproduce the tables and figures in this paper solely for use in journalistic or scholarly works. Attention Is All You Need Ashish Vaswani∗ Google Brain avaswani@google.com Noam Shazeer∗ Google Brain noam@google.com Niki Parmar∗ Google Research nikip@google.com Jakob Uszkoreit∗ Google Research usz@google.com Llion Jones∗ Google Research llion@google.com Aidan N. Gomez∗† University of Toronto aidan@cs.toronto.edu Łukasz Kaiser∗ Google Brain lukaszkaiser@google.com Illia Polosukhin∗‡ illia.polosukhin@gmail.com Abstract The dominant sequence transduction models are based on complex recurrent or convolutional neural netw",
              "locator": "chars:25-2880",
              "slot": "claim",
              "snippetHash": "sha256:c7010b53564c8251672fa3136bc5228040ce2d3335a39bad342b77bdfa8b8153",
              "sourceId": "1706.03762",
              "sourceRef": "papers_dir/parsed/1706.03762/document.md",
              "status": "ready",
              "warnings": []
            },
            {
              "citationLabel": "S1",
              "contentHash": "sha256:2d77fa9629e22a4e1d70afe64261cafcd970972e2c4c2bd0f7d6fad20955439f",